<!DOCTYPE LIST SYSTEM "E:\XML WEBSERVICES\PRESIDENT.dtd">
<LIST>
<PRESIDENT>
<NAME>
<FIRST>GEORGE</FIRST>
<MIDDLE />
<LAST>WASHINGTON</LAST>
</NAME>
<TERM>
<TERMSTART>1789</TERMSTART>
<TERMEND>1797</TERMEND>
<TERMLENGTH>6</TERMLENGTH>
</TERM>
<PARTY>N/A</PARTY>
<HOMESTATE>VIRGINIA</HOMESTATE>
</PRESIDENT>
</LIST>

